[
  {
    "id": "roofing-01",
    "industry": "Roofing",
    "name": "Kidd Roofing",
    "website": "https://www.kiddroof.com/",
    "google_maps_url": null,
    "rating": 4.9,
    "review_count": 768,
    "phone": "512-671-7791",
    "email": null,
    "city": "Austin",
    "state": "TX",
    "website_signals": {
      "https": true,
      "mobile_friendly": false,
      "cta": false,
      "quote_form": false,
      "contact_form": false,
      "financing": true,
      "warranty": true,
      "faq": false,
      "about_us": true,
      "team_page": false,
      "certifications": true,
      "service_area": true,
      "portfolio": false,
      "case_studies": false,
      "before_after": false,
      "testimonials": true,
      "customer_photos": false,
      "customer_videos": false
    },
    "social": {
      "instagram": null,
      "facebook": "https://www.facebook.com/kiddroofing/",
      "youtube": null,
      "tiktok": null
    },
    "review_snippets": [],
    "homepage_text_excerpt": "Kidd Roofing has been protecting Austin-area homes since 1982, offering residential and commercial roofing including new construction, re-roofing, and repair service. The company positions itself as a large, established regional contractor now also serving DFW, Houston, San Antonio, Denver, and Orlando. Messaging emphasizes decades of trusted craftsmanship, an A+ BBB rating, GAF partner status, and financing options for re-roofing and remodeling projects, including help for unexpected large jobs. Warranty coverage is highlighted as 10+ years on labor plus a lifetime manufacturer's warranty on materials. The site also promotes its role as the official roofing partner of Austin FC. NOTE: This excerpt is reconstructed from third-party search-result descriptions of the site, not a direct fetch of the live homepage text (WebFetch was unavailable in this session), so exact wording may differ from the actual page copy.",
    "sources": [
      "https://www.kiddroof.com/",
      "https://www.kiddroof.com/about-us/",
      "https://www.kiddroof.com/testimonials/",
      "https://www.bbb.org/us/tx/austin/profile/roofing-contractors/kidd-roofing-0825-42414",
      "https://www.yelp.com/biz/kidd-roofing-austin",
      "https://www.gaf.com/en-us/roofing-contractors/residential/usa/tx/austin/kidd-roofing-1003943",
      "https://www.facebook.com/kiddroofing/",
      "https://reviewsby.tseg.com/kidd-roofing-159182942502922"
    ]
  },
  {
    "id": "roofing-02",
    "industry": "Roofing",
    "name": "Bold Brothers Roofing",
    "website": "https://www.boldbrothersroofing.com/",
    "google_maps_url": null,
    "rating": 5.0,
    "review_count": 127,
    "phone": null,
    "email": null,
    "city": "Denver",
    "state": "CO",
    "website_signals": {
      "https": true,
      "mobile_friendly": false,
      "cta": false,
      "quote_form": false,
      "contact_form": false,
      "financing": false,
      "warranty": true,
      "faq": false,
      "about_us": true,
      "team_page": true,
      "certifications": true,
      "service_area": false,
      "portfolio": false,
      "case_studies": false,
      "before_after": false,
      "testimonials": false,
      "customer_photos": false,
      "customer_videos": false
    },
    "social": {
      "instagram": "https://www.instagram.com/boldbrothersroofing/",
      "facebook": "https://www.facebook.com/boldbrothersroofing/",
      "youtube": null,
      "tiktok": null
    },
    "review_snippets": [],
    "homepage_text_excerpt": "Bold Brothers Roofing is a Denver-metro (Lakewood, CO) residential and commercial roofing company founded in May 2014 by brothers Nick and Scott Seibold. The company was named Forbes' #1 Roofing Contractor in Denver for 2024 and Top Rated Local's #1 roofing contractor in Colorado. Marketing emphasizes an A+ BBB rating with no complaints, a limited lifetime manufacturer warranty on shingles, and a five-year workmanship warranty on full roof installations. The About Us page names the founding brothers directly. NOTE: This excerpt is reconstructed from third-party search-result descriptions of the site, not a direct fetch of the live homepage text (WebFetch was unavailable in this session), so exact wording may differ from the actual page copy.",
    "sources": [
      "https://www.boldbrothersroofing.com/",
      "https://www.boldbrothersroofing.com/about-us/",
      "https://www.bbb.org/us/co/lakewood/profile/roofing-contractors/bold-brothers-roofing-1296-90168727",
      "https://www.topratedlocal.com/bold-brothers-roofing-reviews",
      "https://www.facebook.com/boldbrothersroofing/",
      "https://www.instagram.com/boldbrothersroofing/?hl=en",
      "https://www.angi.com/companylist/us/co/lakewood/bold-brothers-roofing-co-reviews-1.htm"
    ]
  },
  {
    "id": "roofing-03",
    "industry": "Roofing",
    "name": "Adamson Roofing Company",
    "website": "https://www.adamsonroofingcompany.com/",
    "google_maps_url": null,
    "rating": 4.9,
    "review_count": 110,
    "phone": "(678) 424-1919",
    "email": null,
    "city": "Atlanta",
    "state": "GA",
    "website_signals": {
      "https": true,
      "mobile_friendly": false,
      "cta": false,
      "quote_form": false,
      "contact_form": false,
      "financing": true,
      "warranty": true,
      "faq": false,
      "about_us": false,
      "team_page": false,
      "certifications": true,
      "service_area": true,
      "portfolio": false,
      "case_studies": false,
      "before_after": false,
      "testimonials": false,
      "customer_photos": false,
      "customer_videos": false
    },
    "social": {
      "instagram": null,
      "facebook": "https://www.facebook.com/adamsonroofingcompany/",
      "youtube": null,
      "tiktok": null
    },
    "review_snippets": [],
    "homepage_text_excerpt": "Adamson Roofing Company, LLC is a full-service roofing contractor headquartered in Smyrna, GA serving the greater Atlanta metro for more than 20 years. It markets itself as a GAF Master Elite Certified installer, CertainTeed ShingleMaster, and Owens Corning Preferred Contractor, with an A+ BBB rating and no filed complaints. Financing options are offered, and the site has dedicated pages for residential roofing and specific service areas across metro Atlanta. Customers describe the owner (Len) and crew favorably for professionalism, pricing, and workmanship. NOTE: This excerpt is reconstructed from third-party search-result descriptions of the site, not a direct fetch of the live homepage text (WebFetch was unavailable in this session), so exact wording may differ from the actual page copy.",
    "sources": [
      "https://www.adamsonroofingcompany.com/",
      "https://adamsonroofingcompany.com/residential-roofing/",
      "https://www.bbb.org/us/ga/smyrna/profile/roofing-contractors/adamson-roofing-company-0443-11003891",
      "https://www.yelp.com/biz/adamson-roofing-company-smyrna",
      "https://www.facebook.com/adamsonroofingcompany/",
      "https://www.guildquality.com/AdamsonRoofingCompanyLLC",
      "https://www.angi.com/companylist/us/ga/smyrna/adamson-roofing-company-reviews-6494682.htm"
    ]
  },
  {
    "id": "roofing-04",
    "industry": "Roofing",
    "name": "Gibson Roofing",
    "website": "https://gibsonroofing.com/",
    "google_maps_url": null,
    "rating": 4.9,
    "review_count": 105,
    "phone": "503-690-7663",
    "email": "info@gibsonroofing.com",
    "city": "Portland",
    "state": "OR",
    "website_signals": {
      "https": true,
      "mobile_friendly": false,
      "cta": false,
      "quote_form": false,
      "contact_form": true,
      "financing": true,
      "warranty": true,
      "faq": false,
      "about_us": true,
      "team_page": false,
      "certifications": true,
      "service_area": true,
      "portfolio": false,
      "case_studies": false,
      "before_after": false,
      "testimonials": true,
      "customer_photos": false,
      "customer_videos": false
    },
    "social": {
      "instagram": null,
      "facebook": "https://www.facebook.com/GibsonRoofing/",
      "youtube": null,
      "tiktok": null
    },
    "review_snippets": [],
    "homepage_text_excerpt": "Gibson Roofing, based in Damascus, OR, is one of the oldest roofing companies serving the Portland metro area, led by owner Steve Gibson. The site markets residential and commercial roofing, siding, gutters, windows, doors, and insulation. It has a dedicated service-areas page listing Portland, Clackamas, Milwaukie, Gresham, Boring, Sandy, Gladstone, Troutdale, Estacada, Lake Oswego, West Linn, Happy Valley, Beaverton, and Oregon City, a company-history/about page, a reviews page, and a contact page. As an Owens Corning Platinum Preferred Contractor, the company offers a Platinum warranty and financing options. NOTE: This excerpt is reconstructed from third-party search-result descriptions of the site, not a direct fetch of the live homepage text (WebFetch was unavailable in this session), so exact wording may differ from the actual page copy.",
    "sources": [
      "https://gibsonroofing.com/",
      "https://gibsonroofing.com/reviews/",
      "https://gibsonroofing.com/contact/",
      "https://gibsonroofing.com/roofing-service-areas/",
      "https://gibsonroofing.com/roofingcompany-history-portland-oregon/",
      "https://www.yelp.com/biz/gibson-roofing-damascus",
      "https://www.facebook.com/GibsonRoofing/",
      "https://www.bbb.org/us/or/damascus/profile/roofing-contractors/gibson-roofing-1296-22083672"
    ]
  },
  {
    "id": "roofing-05",
    "industry": "Roofing",
    "name": "Best Roofing Now",
    "website": "https://www.bestroofingnow.com/",
    "google_maps_url": null,
    "rating": 5.0,
    "review_count": 64,
    "phone": "(704) 605-6047",
    "email": null,
    "city": "Charlotte",
    "state": "NC",
    "website_signals": {
      "https": true,
      "mobile_friendly": false,
      "cta": false,
      "quote_form": false,